{
  "version": 1,
  "last_task_number": 166,
  "memories": [
    {
      "title": "변경이력 제거 검토 결정 — A안 확정",
      "date": "2026-08-14",
      "type": "task",
      "status": "active",
      "file": "memory/변경이력_제거_검토_결정_A안_확정.md",
      "summary": "프레임워크 md 137개 변경이력 표+버전표기 22건 제거 확정. 생성·검증 측 동반 개정 필수"
    },
    {
      "title": "워커 code-scan 우선 강제 격상 검토",
      "date": "2026-09-09",
      "type": "improvement",
      "status": "candidate",
      "file": "memory/워커_code_scan_우선_강제_격상_검토.md",
      "summary": "010 Phase 2 후속. 워커 7종은 권고 수준(MUST·게이트 없음). 106은 PM측만 도구 판정 승격"
    },
    {
      "title": "worker.dispatch receipt 블록 누락",
      "date": "2026-09-12",
      "type": "improvement",
      "status": "candidate",
      "file": "memory/워커_디스패치_시_worker_dispatch_receipt_블록_누락.md",
      "summary": "태스크 118 TEST 단계에서 PM이 opal-convention-checker 디스패치 프롬프트에 worker.dispatch receip…"
    },
    {
      "title": "태스크 규모와 파이프라인 프로필 동시 결정",
      "date": "2026-09-12",
      "type": "improvement",
      "status": "candidate",
      "file": "memory/파일럿_태스크_설계_시_주제_규모와_파이프라인_프로필을_함께_결정한다.md",
      "summary": "태스크 119의 파일럿(태스크 121)에 opd 풀 파이프라인 16행을 붙였으나 제안서 §11 Phase 2는 opds 한 프로필을 지정했고,…"
    },
    {
      "title": "OPAL WorkStudio 제품 개발 방향",
      "date": "2026-09-12",
      "type": "architecture",
      "status": "active",
      "file": "memory/OPAL_WorkStudio_제품_개발_방향.md",
      "summary": "백로그 SSOT와 MVP Agent 대화 흐름, Orca Terminal 참조 원칙"
    },
    {
      "title": "워커 자기보고 부재 ≠ 산출물 부재",
      "date": "2026-09-15",
      "type": "improvement",
      "status": "candidate",
      "file": "memory/워커_자기보고_부재를_산출물_부재로_간주하지_않는_실측_판정을_PM_절차에_상시화.md",
      "summary": "태스크 123에서 워커가 긴 포그라운드 명령 뒤 '존재하지 않는 알림을 기다린다'는 문구만 반환하고 종료한 사례가 8건 누적됐다. 대부분 산출…"
    },
    {
      "title": "test-tool red_required 갱신 부재",
      "date": "2026-09-15",
      "type": "improvement",
      "status": "candidate",
      "file": "memory/test_tool에_red_required_갱신_경로_부재_시나리오_성격_오배정의_되돌림_비용이_전량_재실행.md",
      "summary": "TEST-SCENARIO 작성 시 보존·회귀 가드형 시나리오(S-9)를 '구현 전 RED'로 잘못 배정했다. 구현 전에 이미 통과하는 시나리오…"
    },
    {
      "title": "install 시드 병합이 top-level 키 단위",
      "date": "2026-09-15",
      "type": "improvement",
      "status": "candidate",
      "file": "memory/install_mac_sh_시드_병합이_top_level_키_단위라_신규_하위_키가_기존_사용자에게_전파되지_않음.md",
      "summary": "scripts/install-mac.sh의 SEED_KEYS 루프가 'if key in existing: continue'로 판정한다. qui…"
    },
    {
      "title": "워크트리 선행 실패가 라우터 회귀 32건을 가렸다",
      "date": "2026-09-15",
      "type": "improvement",
      "status": "candidate",
      "file": "memory/워크트리_선행_실패가_라우터_회귀_32건을_가렸다.md",
      "summary": "사전 존재 실패를 기준선에 넣으면 그 범위의 신규 회귀를 탐지할 수 없다"
    },
    {
      "title": "PM 권고 전 기존 테스트 자산 확인 누락",
      "date": "2026-09-16",
      "type": "improvement",
      "status": "candidate",
      "file": "memory/PM_권고_전_기존_테스트_자산_확인_누락.md",
      "summary": "태스크 135에서 PM이 'run_log_core.append에 data 키 집합 폐쇄 검사를 추가하자'를 소유자에게 권고해 승인까지 받았으나…"
    },
    {
      "title": "brain-tool add-page 인자는 슬러그",
      "date": "2026-09-17",
      "type": "improvement",
      "status": "candidate",
      "file": "memory/brain_tool_add_page의_위치_인자는_페이지_슬러그다.md",
      "summary": "139 CLOSE에서 add-page의 위치 인자에 브레인 루트(.opal/brain)를 넘겨 슬러그가 'brain'인 페이지가 만들어졌다.…"
    },
    {
      "title": "검증 순서에서 npm run build를 마지막에 두고 dist를 정리한다",
      "date": "2026-09-18",
      "type": "improvement",
      "status": "candidate",
      "file": "memory/검증_순서에서_npm_run_build를_마지막에_두고_dist를_정리한다.md",
      "summary": "dashboard/frontend의 api-env-files.test.ts가 '저장소 dist/를 남기지 않는다'를 단언한다. 검증 중 npm…"
    },
    {
      "title": "PM Gate에서 plan-contract-check 실행을 누락했다",
      "date": "2026-09-18",
      "type": "improvement",
      "status": "candidate",
      "file": "memory/PM_Gate에서_plan_contract_check_실행을_누락했다.md",
      "summary": "PLAN PM Gate 시 state-tool verify --plan-contract-check를 돌리지 않아 Work items의 실행 그…"
    },
    {
      "title": "워커의 생략 판단을 실동작 영향 검증 없이 수락해 결함을 키웠다",
      "date": "2026-09-18",
      "type": "improvement",
      "status": "candidate",
      "file": "memory/워커의_생략_판단을_실동작_영향_검증_없이_수락해_결함을_키웠다.md",
      "summary": "W-2 fixture가 registry name 자리에 frontmatter name을 넣은 부정확성을 PM이 '실동작에 영향 없음'으로 판단…"
    },
    {
      "title": "회귀 검증이 빌드 exit code만 보고 산출물 자산 경로를 보지 않는다",
      "date": "2026-09-18",
      "type": "improvement",
      "status": "candidate",
      "file": "memory/회귀_검증이_빌드_exit_code만_보고_산출물_자산_경로를_보지_않는다.md",
      "summary": "DEC-8 6단계의 마지막 npm run build는 exit code만 확인한다. 이번 태스크에서 빌드는 성공했으나 산출 index.html…"
    },
    {
      "title": "태스크 140 상세 화면 공백을 배포 후에야 발견했다",
      "date": "2026-09-18",
      "type": "improvement",
      "status": "candidate",
      "file": "memory/태스크_140_상세_화면_공백을_배포_후에야_발견했다.md",
      "summary": "140은 슬롯 7종 파서를 만들고 화면까지 완성했으나 실 코퍼스 55건 전부에서 추출 결과가 0건이었다. 파서 테스트는 파서가 기대하는 형태의…"
    },
    {
      "title": "워커 디스패치 직후 작업 행을 마킹하지 않는다",
      "date": "2026-09-19",
      "type": "improvement",
      "status": "candidate",
      "file": "memory/워커_디스패치_직후_작업_행을_마킹하지_않는다.md",
      "summary": "145에서 PLAN 워커를 디스패치한 직후 3행을 done으로 마킹했다. 워커는 비동기로 아직 실행 중이었고, state-tool에는 ✅→⬜…"
    },
    {
      "title": "비차단 보고 후 턴을 끝내지 않는다",
      "date": "2026-09-19",
      "type": "improvement",
      "status": "candidate",
      "file": "memory/비차단_보고_후_턴을_끝내지_않는다.md",
      "summary": "agentic 모드에서 state-tool이 transition_action=continue·report_type=progress_report…"
    },
    {
      "title": "디스패치 프롬프트의 외부 CLI 플래그는 실측으로 확인하고 적는다",
      "date": "2026-09-19",
      "type": "improvement",
      "status": "candidate",
      "file": "memory/디스패치_프롬프트의_외부_CLI_플래그는_실측으로_확인하고_적는다.md",
      "summary": "145에서 PM이 워커 프롬프트에 'orca terminal read --scrollback/--lines'라고 적었으나 실제 플래그는 --c…"
    }
  ],
  "history": [
    {
      "title": "164 워크트리 메타 태스크폴더 권한 분리",
      "date": "2026-09-28",
      "stage": "완료",
      "path": "tasks/164-260928-opds-워크트리-메타-태스크폴더-권한-분리/",
      "result": "registry 메타를 .meta/task_{NNN}/meta.json 태스크 폴더로 분리하고 Codex 세션에 자기 메타 폴더만 --add-dir 부여, 런처 기동 전 점검(원인 코드 4종·git 쓰기 경고) 추가. TEST 12/12 PASS, 배포본 실측 재확인"
    },
    {
      "title": "162 TEST 단계 소요시간 단축",
      "date": "2026-09-28",
      "stage": "완료",
      "path": "tasks/162-260927-opd-TEST-단계-소요시간-단축/",
      "result": "opd/opds TEST에 사람 조치 선요청·자동 실행 병행·증거 재사용·최종 Gate 주기와 계측을 도입하고 병행 계측 유실을 잠금으로 수정함. 시나리오 10/10 통과, main 머지 완료."
    },
    {
      "title": "163 코덱스 워크트리 부팅 소유권 복구",
      "date": "2026-09-28",
      "stage": "완료",
      "path": "tasks/163-260927-opds-코덱스-워크트리-부팅-소유권-복구/",
      "result": "Codex 자식 세션의 lease와 registry 소유권 확정 순서를 복구하고 실패 시 허브 복귀·진단을 구현함. 필수 시나리오 10/10 통과, 실제 Codex 작업본 기동 및 checkpoint 확인, main 머지 완료."
    },
    {
      "title": "161 검증도구 실행정확성 복구",
      "date": "2026-09-27",
      "stage": "완료",
      "path": "tasks/161-260927-opd-검증도구-실행정확성-복구/",
      "result": "test-tool unit의 설치 확인과 실제 검사를 분리하고 미실행·실패·범위를 구조화해 기록함. 실도구 검증 13/13 통과, 회귀 테스트 569건 통과, main 머지 완료."
    },
    {
      "title": "160 opst OPPB 지원",
      "date": "2026-09-26",
      "stage": "완료",
      "path": "tasks/160-260926-opst-OPPB-지원/",
      "result": "opst OPPB 판정 프로필·TODO CRUD 시나리오 추가, 실실행에서 OPPB worktree 미회수 검출"
    }
  ]
}
